{
  "schema_version": 1,
  "run_id": "legacy-sets-000P-gpt56sol",
  "run_kind": "historical-import",
  "task_id": "legacy-sets-000P",
  "source_commit": "a04446e57ec1fbc252a871afcec7752fb2807b14",
  "unit_ids": [
    "tag:000P:statement",
    "tag:000P:proof"
  ],
  "harness": {
    "id": "codex",
    "version": "unknown",
    "adapter_version": "stacks-harness-v1"
  },
  "model": {
    "record_id": "openai:gpt-5.6-sol:owner-confirmed",
    "provider": "OpenAI",
    "requested_id": "gpt-5.6-sol",
    "resolved_id": "gpt-5.6-sol",
    "snapshot": null,
    "identity_confidence": "owner-confirmed"
  },
  "inputs": {
    "prompt_version": "translator-v2",
    "policy_revision": "git:f670695f81c7b758f4623ab8718dc6cf2221d39e",
    "glossary_revision": "git:61cab81ecc45cb258037d5f062f36255137ccaf4",
    "context_hashes": [
      "sha256:d5d1f357ab537852947eea4d224d2d5712f27eaee2f4a40ae044283b6ecf757e",
      "sha256:f219e31936605e036f5b45791003548c0b227c7d3fee8935895610661274d10a"
    ]
  },
  "created_at": "2026-08-25T07:50:00+08:00",
  "replayable": false,
  "status": "recorded",
  "notes": [
    "Historical candidate import; model identity confirmed by project owner.",
    "The original Codex runtime did not expose a provider snapshot."
  ]
}
