{
  "created_at": "2026-10-16T05:09:08.940424Z",
  "harness": {
    "adapter_version": "stacks-harness-v1",
    "id": "codex",
    "version": "0.162.0-alpha.17.2"
  },
  "inputs": {
    "context_hashes": [
      "sha256:92267d25c15cacc4ed17f3c53362890236e6778e08a9c067e7dbdd2cf6893e23",
      "sha256:a4cc0b92dad465fe5f223ab0b1e3ebde86403b339ed47139995b3cd013eb7cfd"
    ],
    "glossary_revision": "git:5b527d9cf753ba3f589d1cc7fe9d18be31ddfd81",
    "policy_revision": "git:5b527d9cf753ba3f589d1cc7fe9d18be31ddfd81",
    "prompt_version": "translator-v2",
    "settings": {
      "actual_runtime_by_unit": [
        {
          "actual_thread": "01a1286b-8ccb-7590-b366-ddf029a39aea",
          "complete_freeze_hash": "sha256:240b8bbcfedb93a5f8185ebb17541daac6f25c64110a484e854f51a6b7a65f80",
          "effort": "xhigh",
          "frozen_context_hash": "sha256:92267d25c15cacc4ed17f3c53362890236e6778e08a9c067e7dbdd2cf6893e23",
          "literal_call_timestamp": "2026-10-15T04:09:48.818Z",
          "literal_file_hash": "sha256:aa2d629b64420dc448acde0595846e69f597ea883f193f03bfd97f769d3f8f73",
          "model": "gpt-6.1-sol",
          "scope_manifest_hash": "sha256:8f23e238f12db9f46f89b1de4eb49a96fffd7da771fff51bfebfc72477cec8ac",
          "turn_id": "01a13db2-ca1f-74f1-ae2c-351eb78d0a42",
          "unit_id": "tag:03B3:title",
          "verified_before_output_at": "2026-10-15T04:06:50.789050+00:00"
        },
        {
          "actual_thread": "01a1286b-8ccb-7590-b366-ddf029a39aea",
          "complete_freeze_hash": "sha256:240b8bbcfedb93a5f8185ebb17541daac6f25c64110a484e854f51a6b7a65f80",
          "effort": "xhigh",
          "frozen_context_hash": "sha256:a4cc0b92dad465fe5f223ab0b1e3ebde86403b339ed47139995b3cd013eb7cfd",
          "literal_call_timestamp": "2026-10-15T04:09:48.818Z",
          "literal_file_hash": "sha256:aa2d629b64420dc448acde0595846e69f597ea883f193f03bfd97f769d3f8f73",
          "model": "gpt-6.1-sol",
          "scope_manifest_hash": "sha256:8f23e238f12db9f46f89b1de4eb49a96fffd7da771fff51bfebfc72477cec8ac",
          "turn_id": "01a13db2-ca1f-74f1-ae2c-351eb78d0a42",
          "unit_id": "tag:03B3:prose-0001",
          "verified_before_output_at": "2026-10-15T04:06:50.789050+00:00"
        }
      ],
      "assembly_harness_version": "0.163.0-alpha.10.2",
      "reasoning_effort": "xhigh",
      "source_catalog_revisions": [
        "sha256:69fa6147716833b2bcc80d476341061319f7131197c81d4a073b55c3a478ee48"
      ]
    }
  },
  "model": {
    "identity_confidence": "declared",
    "provider": "OpenAI",
    "record_id": "openai:gpt-6.1-sol:declared",
    "requested_id": "gpt-6.1-sol",
    "resolved_id": "gpt-6.1-sol",
    "snapshot": null
  },
  "notes": [
    "Complete actual five-field model records copied verbatim; programs only protect, serialize, verify and assemble.",
    "Per-unit actual turn, effort, frozen context and literal hashes are recorded; retries retain their original runtime and context identities.",
    "All prior complete groups, candidates, runs and recursive derivation history are preserved.",
    "Candidate only: unknown terms remain pending; no glossary, critic, human language/mathematics or publication approval."
  ],
  "replayable": false,
  "run_id": "run-20261015-bulk-guide-03b3-gpt61sol",
  "run_kind": "revision",
  "schema_version": 1,
  "source_commit": "a04446e57ec1fbc252a871afcec7752fb2807b14",
  "status": "recorded",
  "task_id": "integrated-remediation-f1-f8-20261014",
  "unit_ids": [
    "tag:03B3:title",
    "tag:03B3:prose-0001"
  ]
}
