{
  "created_at": "2026-10-16T05:09:08.940424Z",
  "harness": {
    "adapter_version": "stacks-harness-v1",
    "id": "codex",
    "version": "0.162.0-alpha.17.2"
  },
  "inputs": {
    "context_hashes": [
      "sha256:586873e3054ab49d3e3134e9e4437b9733c4f37c868fb9cbf5ac8fada4cc9dd9",
      "sha256:5c279198054f1ceed0fce75ba81afa82103559fc949b8bd0bc4c87d67381ac0e"
    ],
    "glossary_revision": "git:5b527d9cf753ba3f589d1cc7fe9d18be31ddfd81",
    "policy_revision": "git:5b527d9cf753ba3f589d1cc7fe9d18be31ddfd81",
    "prompt_version": "translator-v2",
    "settings": {
      "actual_runtime_by_unit": [
        {
          "actual_thread": "01a1286b-8ccb-7590-b366-ddf029a39aea",
          "complete_freeze_hash": "sha256:439abc64697be219e634c6a7b26636f13e0677c16c1c7c06bec43a2c677c1bb4",
          "effort": "xhigh",
          "frozen_context_hash": "sha256:586873e3054ab49d3e3134e9e4437b9733c4f37c868fb9cbf5ac8fada4cc9dd9",
          "literal_call_timestamp": "2026-10-15T04:52:10.396Z",
          "literal_file_hash": "sha256:8cf2454c211882bd0f038c3c0252761ca2ff07528ba8e3c3a88807b5aebdc96a",
          "model": "gpt-6.1-sol",
          "scope_manifest_hash": "sha256:8f23e238f12db9f46f89b1de4eb49a96fffd7da771fff51bfebfc72477cec8ac",
          "turn_id": "01a13dce-e94a-7213-9b7f-544359b0d5d8",
          "unit_id": "tag:04V0:title",
          "verified_before_output_at": "2026-10-15T04:51:12.657664+00:00"
        },
        {
          "actual_thread": "01a1286b-8ccb-7590-b366-ddf029a39aea",
          "complete_freeze_hash": "sha256:5c404e095a5cca8aa93f62c0fa203449a252f83aef5f4f07402121874029a992",
          "effort": "xhigh",
          "frozen_context_hash": "sha256:5c279198054f1ceed0fce75ba81afa82103559fc949b8bd0bc4c87d67381ac0e",
          "literal_call_timestamp": "2026-10-15T17:35:58.177Z",
          "literal_file_hash": "sha256:e5661309c91935d4b3855db132cc5b48f5ed335a8c22f533c59e89daa9e7e581",
          "model": "gpt-6.1-sol",
          "scope_manifest_hash": "sha256:8b4496291a99a73b7339fd63a2b45045749f0da78dd7985354f23aa3117ee4f2",
          "turn_id": "01a14070-ca99-7420-bc8a-686856048ded",
          "unit_id": "tag:04V0:prose-0001",
          "verified_before_output_at": "2026-10-15T17:31:32.739841+00:00"
        }
      ],
      "assembly_harness_version": "0.163.0-alpha.10.2",
      "reasoning_effort": "xhigh",
      "source_catalog_revisions": [
        "sha256:82aca260354c680396c7e96aff78c7bebf63e12b27a46bf5b73652d13eccd44a",
        "sha256:8b5d05f0f9543f16e11b270ffa7a5f946f7783dd73e26342acc755f7f3c3e294"
      ]
    }
  },
  "model": {
    "identity_confidence": "declared",
    "provider": "OpenAI",
    "record_id": "openai:gpt-6.1-sol:declared",
    "requested_id": "gpt-6.1-sol",
    "resolved_id": "gpt-6.1-sol",
    "snapshot": null
  },
  "notes": [
    "Complete actual five-field model records copied verbatim; programs only protect, serialize, verify and assemble.",
    "Per-unit actual turn, effort, frozen context and literal hashes are recorded; retries retain their original runtime and context identities.",
    "All prior complete groups, candidates, runs and recursive derivation history are preserved.",
    "Candidate only: unknown terms remain pending; no glossary, critic, human language/mathematics or publication approval."
  ],
  "replayable": false,
  "run_id": "run-20261015-bulk-guide-04v0-gpt61sol",
  "run_kind": "revision",
  "schema_version": 1,
  "source_commit": "a04446e57ec1fbc252a871afcec7752fb2807b14",
  "status": "recorded",
  "task_id": "integrated-remediation-f1-f8-20261014",
  "unit_ids": [
    "tag:04V0:title",
    "tag:04V0:prose-0001"
  ]
}
