{
  "created_at": "2026-10-14T00:03:50.256258Z",
  "harness": {
    "adapter_version": "stacks-harness-v1",
    "id": "codex",
    "version": "0.162.0-alpha.17.2"
  },
  "inputs": {
    "context_hashes": [
      "sha256:cb0ed9cc16943f4842c8d1589fcb65cb6b16d6391fb71f039aaa9a5cf1a59627",
      "sha256:17c5a174baaabd3ff105dc796c349c63b1f3fefd222da2093daf993c2ea1f1a4",
      "sha256:1f552de3755018dec3581502ef04444cee2ad648919a6174f8a349ce57b93178",
      "sha256:cc516e5c133208469bc8ca71f4ca9ebb99221f4d81a94cf5c37718b233af6c61",
      "sha256:7f29ef99b27e9ce0e3b40f00513bdb5765d570cd3a364c02c5af9c00ece05d9c"
    ],
    "glossary_revision": "git:60b14fe7d608a0142b825f7a37f79b13824ce006",
    "policy_revision": "git:60b14fe7d608a0142b825f7a37f79b13824ce006",
    "prompt_version": "translator-v2",
    "settings": {
      "allow_outside_preferred_range": true,
      "reasoning_effort": "xhigh",
      "runtime_turn_id": "01a137ad-1a69-7613-8bc4-b53d291c919f",
      "scope_reason": "Complete three adjacent current problem batches across true Sections0020/0021: all titles, entire 0020 body with three paragraphs/four items, and complete 0022 lemma/proof. Their full locked source contains 222 words, below preferred300; retain this complete semantic range without padding already accepted batches or slicing/dropping old inputs.",
      "source_words": 222
    }
  },
  "model": {
    "identity_confidence": "declared",
    "provider": "OpenAI",
    "record_id": "openai:gpt-6.1-sol:declared",
    "requested_id": "gpt-6.1-sol",
    "resolved_id": "gpt-6.1-sol",
    "snapshot": null
  },
  "notes": [
    "Complete actual five-field outputs authored by GPT-6.1 Sol in the verified current Codex turn after freezing full new source, prior groups and contexts; programs only serialize, protect, validate and assemble.",
    "One complete correction/run binds three declared v4 derivations and every full old group by explicit per-unit IDs; every original input/raw output/run and existing ancestor remains immutable.",
    "Harness resolved dynamically before freezing and during assembly; model/effort obtained from actual turn_context, snapshot not exposed.",
    "Unknown terminology remains pending; no critic, human language/mathematics review or publication approval is conferred."
  ],
  "replayable": false,
  "run_id": "run-20261014-categories-fibre-examples-gpt61sol",
  "run_kind": "revision",
  "schema_version": 1,
  "source_commit": "a04446e57ec1fbc252a871afcec7752fb2807b14",
  "status": "recorded",
  "task_id": "categories-fibre-examples-20261014",
  "unit_ids": [
    "tag:0020:title",
    "tag:0020:prose-0001",
    "tag:0021:title",
    "tag:0022:statement",
    "tag:0022:proof"
  ]
}
