{
  "created_at": "2026-10-16T05:09:08.940424Z",
  "harness": {
    "adapter_version": "stacks-harness-v1",
    "id": "codex",
    "version": "0.162.0-alpha.17.2"
  },
  "inputs": {
    "context_hashes": [
      "sha256:6487556a906b60a9f449be4904644947eed2e3a90f0ef288081dcdf50edbf051",
      "sha256:88317dbd1acb4715363e26c82b1cdcf853e88fb79c30211f2f93a661ba43fd9a"
    ],
    "glossary_revision": "git:5b527d9cf753ba3f589d1cc7fe9d18be31ddfd81",
    "policy_revision": "git:5b527d9cf753ba3f589d1cc7fe9d18be31ddfd81",
    "prompt_version": "translator-v2",
    "settings": {
      "actual_runtime_by_unit": [
        {
          "actual_thread": "01a1286b-8ccb-7590-b366-ddf029a39aea",
          "complete_freeze_hash": "sha256:5c404e095a5cca8aa93f62c0fa203449a252f83aef5f4f07402121874029a992",
          "effort": "xhigh",
          "frozen_context_hash": "sha256:6487556a906b60a9f449be4904644947eed2e3a90f0ef288081dcdf50edbf051",
          "literal_call_timestamp": "2026-10-15T17:30:07.927Z",
          "literal_file_hash": "sha256:fb149190a16240a80cefc209456b4c63d9378846e58d538f8b461cca106057e6",
          "model": "gpt-6.1-sol",
          "scope_manifest_hash": "sha256:8b4496291a99a73b7339fd63a2b45045749f0da78dd7985354f23aa3117ee4f2",
          "turn_id": "01a14070-ca99-7420-bc8a-686856048ded",
          "unit_id": "tag:02BF:title",
          "verified_before_output_at": "2026-10-15T17:29:10.265056+00:00"
        },
        {
          "actual_thread": "01a1286b-8ccb-7590-b366-ddf029a39aea",
          "complete_freeze_hash": "sha256:5c404e095a5cca8aa93f62c0fa203449a252f83aef5f4f07402121874029a992",
          "effort": "xhigh",
          "frozen_context_hash": "sha256:88317dbd1acb4715363e26c82b1cdcf853e88fb79c30211f2f93a661ba43fd9a",
          "literal_call_timestamp": "2026-10-15T17:30:07.927Z",
          "literal_file_hash": "sha256:fb149190a16240a80cefc209456b4c63d9378846e58d538f8b461cca106057e6",
          "model": "gpt-6.1-sol",
          "scope_manifest_hash": "sha256:8b4496291a99a73b7339fd63a2b45045749f0da78dd7985354f23aa3117ee4f2",
          "turn_id": "01a14070-ca99-7420-bc8a-686856048ded",
          "unit_id": "tag:02BF:paragraph-0001",
          "verified_before_output_at": "2026-10-15T17:29:10.265056+00:00"
        }
      ],
      "assembly_harness_version": "0.163.0-alpha.10.2",
      "reasoning_effort": "xhigh",
      "source_catalog_revisions": [
        "sha256:82aca260354c680396c7e96aff78c7bebf63e12b27a46bf5b73652d13eccd44a"
      ]
    }
  },
  "model": {
    "identity_confidence": "declared",
    "provider": "OpenAI",
    "record_id": "openai:gpt-6.1-sol:declared",
    "requested_id": "gpt-6.1-sol",
    "resolved_id": "gpt-6.1-sol",
    "snapshot": null
  },
  "notes": [
    "Complete actual five-field model records copied verbatim; programs only protect, serialize, verify and assemble.",
    "Per-unit actual turn, effort, frozen context and literal hashes are recorded; retries retain their original runtime and context identities.",
    "All prior complete groups, candidates, runs and recursive derivation history are preserved.",
    "Candidate only: unknown terms remain pending; no glossary, critic, human language/mathematics or publication approval."
  ],
  "replayable": false,
  "run_id": "run-20261015-bulk-desirables-02bf-gpt61sol",
  "run_kind": "revision",
  "schema_version": 1,
  "source_commit": "a04446e57ec1fbc252a871afcec7752fb2807b14",
  "status": "recorded",
  "task_id": "integrated-remediation-f1-f8-20261014",
  "unit_ids": [
    "tag:02BF:title",
    "tag:02BF:paragraph-0001"
  ]
}
