{
  "created_at": "2026-10-23T17:03:41.956348Z",
  "harness": {
    "adapter_version": "stacks-harness-v1",
    "id": "codex",
    "version": "0.163.0-alpha.11.2"
  },
  "inputs": {
    "context_hashes": [
      "sha256:4ee7268788b37eca7219c06638f0ffd42b925804a05cd3b5783304dbfc0e7adc",
      "sha256:d47d5be9aa830a06c4ee5629005940b8e0895d33acf7ea71d7e289c54fc827c5",
      "sha256:a0988db77a45d7b7623cbb3cdeffce1008bf8eb82dffbaa186eb25a91c53b763",
      "sha256:288b5acb60351535b826e99166b4622127750842b473858b1446dd83d2b499b9",
      "sha256:32c6cf2e968b047637e75cbc6ebb39e4b29ad27ef6bdb77afb08e6a2dff8fc4e",
      "sha256:11183b946cef7f1b8c4b06f1acd2c2dea84badc6a16e25d3db77ebf705734d99",
      "sha256:70f3559643386a7c541d3de2820ab31d83905d2624b4dd00f756ea53127bcc5c",
      "sha256:983dee925f8f8896f6de2f9890a7a8c4ae861f6cb9eaa68af8b2502b4f356576",
      "sha256:dfe8172cf23d959f49adc60b5f8b58978d9efa7fb137a553f0af37c3259feb84",
      "sha256:ef6f4985cd3662593f9884e7f55788633e7837a9395315fd870c3965be405a90",
      "sha256:75cb8486b41ed41eede14ce2fceb620e9a6dc3d603c6f3cd994fcdb3da45f975",
      "sha256:6094c3190c6daec0aa4159fe7e48b53927feee8fafe760e1df8e81fc4ef9b9eb",
      "sha256:ed0c6fc0fde76bdfeafc234f1443c76a3072649e1f53cf9f110c6454f6468c1b",
      "sha256:c7709b8068c660ca4c3ae7c155495d102b18490373e98479003cc9700fb2d292",
      "sha256:a8f86d0ce0357b86363f96ff0a4c6aa36b299458972663fbb10998fd196775ef",
      "sha256:03715a0791202248afaa271f844a9567c1a11be10995ca57cd8d5e38327aa999",
      "sha256:4a8811426573a16f8c23ee474581b22575feef9b4a6df47584f70a834609c8c3",
      "sha256:4a5bd9bb8051f2d6716e7e1b2ac65863665f3b8af04ebf5e845c83d5fa21de0f",
      "sha256:7d05b7307fc2b6b6217a6dd2d47b6f3c300e6914fea24860142df2aac5547740",
      "sha256:3f9d2b0cd3a9dd693e4bc02c912b681a81910f9d348f96c5b27f9e994858760e",
      "sha256:4e121cec22c9c2572611390c9a92f81d20dd1ad69bf89088bab6d38f75f4c764"
    ],
    "glossary_revision": "git:fdc35145795557af18d3622e13b9a1602463706e",
    "policy_revision": "git:fdc35145795557af18d3622e13b9a1602463706e",
    "prompt_version": "translator-v2",
    "settings": {
      "input_freeze": {
        "hash": "sha256:76d21f1569194b57e52612dc565e04aa0f6744819f13863df964b8250eb8fd48",
        "path": "translation-data/source-adoption-inputs/sites-complete-g008-20261023.json"
      },
      "reasoning_effort": "high",
      "source_adoption_id": "sites-complete-g008-20261023",
      "turn_id": "01a169aa-8d15-74a2-8684-b15cf1bec7a1"
    }
  },
  "model": {
    "identity_confidence": "declared",
    "provider": "OpenAI",
    "record_id": "openai:gpt-6.1-sol:declared",
    "requested_id": "gpt-6.1-sol",
    "resolved_id": "gpt-6.1-sol",
    "snapshot": null
  },
  "notes": [
    "Complete first source adoption; candidate only, no review or publication approval."
  ],
  "replayable": false,
  "run_id": "run-sites-complete-g008-20261023",
  "run_kind": "translation",
  "schema_version": 1,
  "source_commit": "a04446e57ec1fbc252a871afcec7752fb2807b14",
  "status": "recorded",
  "task_id": "sites-complete-20261023",
  "unit_ids": [
    "tag:00WL:title",
    "tag:00WM:statement",
    "tag:00WN:statement",
    "tag:00WN:proof",
    "tag:086K:statement",
    "tag:086K:proof",
    "tag:00WO:title",
    "tag:00WO:prose-0001",
    "tag:00WP:statement",
    "tag:00WO:prose-0002",
    "tag:00WQ:statement",
    "tag:00WO:prose-0003",
    "tag:00WR:statement",
    "tag:00WO:prose-0004",
    "tag:00WT:statement",
    "tag:00WT:proof",
    "tag:00WO:prose-0005",
    "tag:00WS:statement",
    "tag:00WS:proof",
    "tag:0GLW:statement",
    "tag:0GLW:proof"
  ]
}
