{
  "created_at": "2026-10-24T17:01:42.283167Z",
  "harness": {
    "adapter_version": "stacks-harness-v1",
    "id": "codex",
    "version": "0.164.0"
  },
  "inputs": {
    "context_hashes": [
      "sha256:e4320d0aed02eb565084ed41dcd1e9207627f9e145b45076f456de23dc3d08ae",
      "sha256:1d905ef7e8897306f6ccf308ee9b3aa25ee32676542a416ac638b91f76740367",
      "sha256:fa05402982e05a990249428a0571e4094967d76ab4139d5aa55652016005f79d",
      "sha256:7d1f8bd0f446d66e700f0c6ba2b072e9c70a6cc5d2b70ff86bf84be09652dea5",
      "sha256:5fc7acd8cee94c42dad6a7cfe26b986341682179c65ee65a083105cd6f992dae",
      "sha256:571054c90779b7d93d3c73164dd1c4b0a0e0f98928b36b275cef22c0ac4917f0",
      "sha256:8cd34d2941b4f5258e48e4744749e4b6b05164921a2c5fcccdc1b5a366c60852",
      "sha256:bf1e9a4e0fe5f692f22baeaa113601ec9d02e24698bff75a33f777300bfd3a82",
      "sha256:6227f9f22b11a898e7c0a8dd398ec5c58acc52f46de3fa7235aedfc162708cca",
      "sha256:a2738464b31d0947b50710cf6f22979fda42cba6d1b7e84c2a84643b9ee4818a",
      "sha256:68002e006934c0f3cebd3b3b3a867773dc6fc97751b20e7c2bb3246cb374afea",
      "sha256:fba65219418c413c233a17507acbf8e9f3ffab5cc592739f038acd8f007be7e7",
      "sha256:4593b9eee7e7105e363d8fd365a55c2b84b4d47fa53b2b6d625b362fa8fae096",
      "sha256:be993fa5f1982927b7e667758c6c95e33bd5f6d28b4573e6dcd98789b774deb2",
      "sha256:60a9c23458e3cfa25ff54d0440fcc178057ec506de6c4b15adf455c5cf2deb74",
      "sha256:5469a7b498369a61e4d32e86add38cf5beec24258d45148297eef324e9a452a8",
      "sha256:73c9720b67f01341e4f67e8cd1b380c4a9c0f38f5839cd621360f728ddde9725",
      "sha256:eb10e93e0d754d8e6fab08ab3840e0c465e113524b0a8e8b0da7ef40b5146d20",
      "sha256:92366f41fc2585bd1b278faeed682667a504067e74c73822d97799cf05a04896",
      "sha256:dcecf2b74cc993c769aec9164f813da7adad165995a774801ac142a427bcff7a",
      "sha256:79137f308d599d580f27d4befedec3addb9a0375a781de2af043ca849c727515",
      "sha256:353c61420cf171268120c41e56aa61fd92c2bab7b76c6911cf32906cdd839271"
    ],
    "glossary_revision": "git:fdc35145795557af18d3622e13b9a1602463706e",
    "policy_revision": "git:fdc35145795557af18d3622e13b9a1602463706e",
    "prompt_version": "translator-v2",
    "settings": {
      "input_freeze": {
        "hash": "sha256:b527f4f1a23bf1ab9486ee0d213d8347faa7504f37765d5ba0ba9787c20b77d3",
        "path": "translation-data/source-adoption-inputs/sites-complete-g035-resumed-20261025.json"
      },
      "reasoning_effort": "high",
      "source_adoption_id": "sites-complete-g035-resumed-20261025",
      "turn_id": "01a16eda-2dee-7c52-95dd-960f66cc62f1"
    }
  },
  "model": {
    "identity_confidence": "declared",
    "provider": "OpenAI",
    "record_id": "openai:gpt-6.1-sol:declared",
    "requested_id": "gpt-6.1-sol",
    "resolved_id": "gpt-6.1-sol",
    "snapshot": null
  },
  "notes": [
    "Complete first source adoption; candidate only, no review or publication approval."
  ],
  "replayable": false,
  "run_id": "run-sites-complete-g035-resumed-20261025",
  "run_kind": "translation",
  "schema_version": 1,
  "source_commit": "a04446e57ec1fbc252a871afcec7752fb2807b14",
  "status": "recorded",
  "task_id": "sites-complete-20261023",
  "unit_ids": [
    "tag:00ZG:title",
    "tag:00ZG:prose-0001",
    "tag:00ZH:statement",
    "tag:00ZH:proof",
    "tag:00ZI:statement",
    "tag:00ZJ:statement",
    "tag:00ZJ:proof",
    "tag:00ZL:statement",
    "tag:00ZM:statement",
    "tag:00ZM:proof",
    "tag:00ZN:title",
    "tag:00ZO:statement",
    "tag:00ZO:proof",
    "tag:00ZP:statement",
    "tag:00ZP:proof",
    "tag:00ZQ:statement",
    "tag:00ZQ:proof",
    "tag:00ZR:title",
    "tag:00ZR:prose-0001",
    "tag:00ZS:title",
    "tag:00ZS:prose-0001",
    "tag:00ZT:statement"
  ]
}
