{
  "schema_version": 1,
  "run_id": "run-20260828-desirables-02BW-gpt56sol-01",
  "run_kind": "translation",
  "task_id": "desirables-02BW",
  "source_commit": "a04446e57ec1fbc252a871afcec7752fb2807b14",
  "unit_ids": ["tag:02BW:title", "tag:02BW:p001"],
  "harness": {
    "id": "codex",
    "version": "codex-cli 0.150.1",
    "adapter_version": "stacks-harness-v1"
  },
  "model": {
    "record_id": "openai:gpt-5.6-sol:owner-confirmed",
    "provider": "OpenAI",
    "requested_id": "gpt-5.6-sol",
    "resolved_id": "gpt-5.6-sol",
    "snapshot": null,
    "identity_confidence": "owner-confirmed"
  },
  "inputs": {
    "prompt_version": "translator-v2",
    "policy_revision": "git:33f9fe1ddc7bed6b69d499c1410197c48414c545",
    "glossary_revision": "git:981e3ab307d1aa36f4ba8e0a6ccd78b6f5a641ba",
    "context_hashes": [
      "sha256:97919c3720f5560733f43ed0a0e1996140735e5c62927cb60bf12c55d6fcc0cd",
      "sha256:cdf46a2482209abb1832f971ae3d5e3ed1f2b0226f33e7177f56c05dedaf3f31"
    ]
  },
  "created_at": "2026-08-28T19:42:00+08:00",
  "replayable": false,
  "status": "recorded",
  "notes": []
}
