{
  "schema_version": 1,
  "run_id": "run-review-categories-0ahm-20261005",
  "run_kind": "revision",
  "task_id": "review-categories-0ahm-20261005",
  "source_commit": "a04446e57ec1fbc252a871afcec7752fb2807b14",
  "unit_ids": [
    "tag:0AHM:title",
    "tag:0AHM:p001",
    "tag:0AHN:statement",
    "tag:0AHN:proof-p001",
    "tag:0AHP:statement",
    "tag:0AHQ:statement",
    "tag:0AHQ:proof-p001"
  ],
  "harness": {
    "id": "codex",
    "version": "0.160.0",
    "adapter_version": "stacks-harness-v1"
  },
  "model": {
    "record_id": "openai:gpt-6.1-sol:declared",
    "provider": "OpenAI",
    "requested_id": "gpt-6.1-sol",
    "resolved_id": "gpt-6.1-sol",
    "snapshot": null,
    "identity_confidence": "declared"
  },
  "inputs": {
    "prompt_version": "translator-v2",
    "policy_revision": "git:f57169e38f753bacdcf00476d2fc76263a0e3711",
    "glossary_revision": "git:981e3ab307d1aa36f4ba8e0a6ccd78b6f5a641ba",
    "context_hashes": [
      "sha256:17366dcec2d9a9a3fe5a0e12535f4ece25ab76566284931bc53ab5c04fed83ca",
      "sha256:33ace9379f5e157f67ab823a1a03d248399ae9057c89df4ad24e6e7b1c542f3b",
      "sha256:36b887f137c6c7a93aaec3e4049d758b391fd36aed0c75813d15e4334a146b3a",
      "sha256:01e208ca7d9622709867250346290622980db3a7628d00bea1ab88aa32de321f",
      "sha256:41cfd9d1ff05157ca3f861e8a33fb5052839348ba0d1a38e7db559abf39533fc",
      "sha256:0a98ed38251aad710f5f60715981069b022431c9ce56431c06e879dd88d70ef8",
      "sha256:d5426fe1f619a293172c9908efbdd5c60a0834b7411a338dac75448cc76dc692"
    ]
  },
  "created_at": "2026-10-05T01:55:11.861765+00:00",
  "replayable": false,
  "status": "recorded",
  "notes": [
    "Actual complete GPT-6.1-sol revision in the current Codex task; declared runtime model, provider snapshot unavailable.",
    "Original units/candidates and complete corrected source/context are frozen. No historical run was rewritten; terminology remains pending and no human or independent critic review is claimed."
  ]
}
