{
  "created_at": "2026-10-16T05:09:08.940424Z",
  "harness": {
    "adapter_version": "stacks-harness-v1",
    "id": "codex",
    "version": "0.162.0-alpha.17.2"
  },
  "inputs": {
    "context_hashes": [
      "sha256:1dbc8e62e42ff096680b22623249c038474f0c94f384e6ee7ea6a11cc75144d6",
      "sha256:8fed688b06a8ef60dc5b3facc74177c1bee4616acd4f706f8c34311886f4aa6c"
    ],
    "glossary_revision": "git:5b527d9cf753ba3f589d1cc7fe9d18be31ddfd81",
    "policy_revision": "git:5b527d9cf753ba3f589d1cc7fe9d18be31ddfd81",
    "prompt_version": "translator-v2",
    "settings": {
      "actual_runtime_by_unit": [
        {
          "actual_thread": "01a132fd-f48d-71c1-9720-6da1384c3aa1",
          "complete_freeze_hash": "sha256:945badc879390ddb5f2cc637437d0470bb0f8c885a152737857d3a174046b40c",
          "effort": "xhigh",
          "frozen_context_hash": "sha256:1dbc8e62e42ff096680b22623249c038474f0c94f384e6ee7ea6a11cc75144d6",
          "literal_call_timestamp": "2026-10-15T14:48:11.207Z",
          "literal_file_hash": "sha256:49a89828a16f220b8148cdcdaeef5dfb481852fb549e62b1f11b3888ae5e398c",
          "model": "gpt-6-astra",
          "scope_manifest_hash": "sha256:8b4496291a99a73b7339fd63a2b45045749f0da78dd7985354f23aa3117ee4f2",
          "turn_id": "01a13ff9-3af1-7451-854e-1518190f638b",
          "unit_id": "tag:000T:title",
          "verified_before_output_at": "2026-10-15T14:46:06.676024+00:00"
        },
        {
          "actual_thread": "01a132fd-f48d-71c1-9720-6da1384c3aa1",
          "complete_freeze_hash": "sha256:945badc879390ddb5f2cc637437d0470bb0f8c885a152737857d3a174046b40c",
          "effort": "xhigh",
          "frozen_context_hash": "sha256:8fed688b06a8ef60dc5b3facc74177c1bee4616acd4f706f8c34311886f4aa6c",
          "literal_call_timestamp": "2026-10-15T14:48:11.207Z",
          "literal_file_hash": "sha256:49a89828a16f220b8148cdcdaeef5dfb481852fb549e62b1f11b3888ae5e398c",
          "model": "gpt-6-astra",
          "scope_manifest_hash": "sha256:8b4496291a99a73b7339fd63a2b45045749f0da78dd7985354f23aa3117ee4f2",
          "turn_id": "01a13ff9-3af1-7451-854e-1518190f638b",
          "unit_id": "tag:000T:paragraph-0001",
          "verified_before_output_at": "2026-10-15T14:46:06.676024+00:00"
        }
      ],
      "assembly_harness_version": "0.163.0-alpha.10.2",
      "reasoning_effort": "xhigh",
      "source_catalog_revisions": [
        "sha256:93ec1ff6f0ac7f85c66d61590793df9a29bf607d46cf24fcf14e179453f3377d"
      ]
    }
  },
  "model": {
    "identity_confidence": "declared",
    "provider": "OpenAI",
    "record_id": "openai:gpt-6-astra:declared",
    "requested_id": "gpt-6-astra",
    "resolved_id": "gpt-6-astra",
    "snapshot": null
  },
  "notes": [
    "Complete actual five-field model records copied verbatim; programs only protect, serialize, verify and assemble.",
    "Per-unit actual turn, effort, frozen context and literal hashes are recorded; retries retain their original runtime and context identities.",
    "All prior complete groups, candidates, runs and recursive derivation history are preserved.",
    "Candidate only: unknown terms remain pending; no glossary, critic, human language/mathematics or publication approval."
  ],
  "replayable": false,
  "run_id": "run-20261015-bulk-sets-000t-gpt6astra",
  "run_kind": "revision",
  "schema_version": 1,
  "source_commit": "a04446e57ec1fbc252a871afcec7752fb2807b14",
  "status": "recorded",
  "task_id": "integrated-remediation-f1-f8-20261014",
  "unit_ids": [
    "tag:000T:title",
    "tag:000T:paragraph-0001"
  ]
}
