{
  "created_at": "2026-10-16T05:09:08.940424Z",
  "harness": {
    "adapter_version": "stacks-harness-v1",
    "id": "codex",
    "version": "0.162.0-alpha.17.2"
  },
  "inputs": {
    "context_hashes": [
      "sha256:83a20acd5b7bb27581134309ee2478ddef6faf0faafa612100dd4ef01dfff87c",
      "sha256:02d3e3d77bf7115d96bb595499667372ecbe5b185b42118965ead42321999c61"
    ],
    "glossary_revision": "git:5b527d9cf753ba3f589d1cc7fe9d18be31ddfd81",
    "policy_revision": "git:5b527d9cf753ba3f589d1cc7fe9d18be31ddfd81",
    "prompt_version": "translator-v2",
    "settings": {
      "actual_runtime_by_unit": [
        {
          "actual_thread": "01a132fd-f48d-71c1-9720-6da1384c3aa1",
          "complete_freeze_hash": "sha256:945badc879390ddb5f2cc637437d0470bb0f8c885a152737857d3a174046b40c",
          "effort": "xhigh",
          "frozen_context_hash": "sha256:83a20acd5b7bb27581134309ee2478ddef6faf0faafa612100dd4ef01dfff87c",
          "literal_call_timestamp": "2026-10-15T14:58:22.018Z",
          "literal_file_hash": "sha256:9345b07b2fe98e67564a08f5e01e603b02c9c9d8dde65d81fd307d303ec6f839",
          "model": "gpt-6-astra",
          "scope_manifest_hash": "sha256:8b4496291a99a73b7339fd63a2b45045749f0da78dd7985354f23aa3117ee4f2",
          "turn_id": "01a13ff9-3af1-7451-854e-1518190f638b",
          "unit_id": "tag:000V:statement",
          "verified_before_output_at": "2026-10-15T14:46:07.153237+00:00"
        },
        {
          "actual_thread": "01a132fd-f48d-71c1-9720-6da1384c3aa1",
          "complete_freeze_hash": "sha256:945badc879390ddb5f2cc637437d0470bb0f8c885a152737857d3a174046b40c",
          "effort": "xhigh",
          "frozen_context_hash": "sha256:02d3e3d77bf7115d96bb595499667372ecbe5b185b42118965ead42321999c61",
          "literal_call_timestamp": "2026-10-15T14:48:39.673Z",
          "literal_file_hash": "sha256:34179606148a2c3039179a494d983875e68e3c52cbffcd01de44791669b4f4e8",
          "model": "gpt-6-astra",
          "scope_manifest_hash": "sha256:8b4496291a99a73b7339fd63a2b45045749f0da78dd7985354f23aa3117ee4f2",
          "turn_id": "01a13ff9-3af1-7451-854e-1518190f638b",
          "unit_id": "tag:000V:proof",
          "verified_before_output_at": "2026-10-15T14:46:07.153237+00:00"
        }
      ],
      "assembly_harness_version": "0.163.0-alpha.10.2",
      "reasoning_effort": "xhigh",
      "source_catalog_revisions": [
        "sha256:93ec1ff6f0ac7f85c66d61590793df9a29bf607d46cf24fcf14e179453f3377d"
      ]
    }
  },
  "model": {
    "identity_confidence": "declared",
    "provider": "OpenAI",
    "record_id": "openai:gpt-6-astra:declared",
    "requested_id": "gpt-6-astra",
    "resolved_id": "gpt-6-astra",
    "snapshot": null
  },
  "notes": [
    "Complete actual five-field model records copied verbatim; programs only protect, serialize, verify and assemble.",
    "Per-unit actual turn, effort, frozen context and literal hashes are recorded; retries retain their original runtime and context identities.",
    "All prior complete groups, candidates, runs and recursive derivation history are preserved.",
    "Candidate only: unknown terms remain pending; no glossary, critic, human language/mathematics or publication approval."
  ],
  "replayable": false,
  "run_id": "run-20261015-bulk-sets-000v-gpt6astra",
  "run_kind": "revision",
  "schema_version": 1,
  "source_commit": "a04446e57ec1fbc252a871afcec7752fb2807b14",
  "status": "recorded",
  "task_id": "integrated-remediation-f1-f8-20261014",
  "unit_ids": [
    "tag:000V:statement",
    "tag:000V:proof"
  ]
}
