{
  "created_at": "2026-10-16T05:09:08.940424Z",
  "harness": {
    "adapter_version": "stacks-harness-v1",
    "id": "codex",
    "version": "0.162.0-alpha.17.2"
  },
  "inputs": {
    "context_hashes": [
      "sha256:c9da2c3d64180ff8a9a15b55838e9b72271669e925b675e0ef6025e03ae8321d",
      "sha256:a1d80a3437b91b21a4ecfd16cb0f78af2b24ee1adae11f270cb2894eb563829a"
    ],
    "glossary_revision": "git:5b527d9cf753ba3f589d1cc7fe9d18be31ddfd81",
    "policy_revision": "git:5b527d9cf753ba3f589d1cc7fe9d18be31ddfd81",
    "prompt_version": "translator-v2",
    "settings": {
      "actual_runtime_by_unit": [
        {
          "actual_thread": "01a1286b-8ccb-7590-b366-ddf029a39aea",
          "complete_freeze_hash": "sha256:da1544ce54c5a7ef426d4f3ab0e971490b73e73b18f91fb09885a14f2518e81e",
          "effort": "xhigh",
          "frozen_context_hash": "sha256:c9da2c3d64180ff8a9a15b55838e9b72271669e925b675e0ef6025e03ae8321d",
          "literal_call_timestamp": "2026-10-15T03:57:14.892Z",
          "literal_file_hash": "sha256:7f171e83b904ac5b39011f9771849e0df00498b9a572d2dcb888e12968a94613",
          "model": "gpt-6.1-sol",
          "scope_manifest_hash": "sha256:8f23e238f12db9f46f89b1de4eb49a96fffd7da771fff51bfebfc72477cec8ac",
          "turn_id": "01a13db2-ca1f-74f1-ae2c-351eb78d0a42",
          "unit_id": "tag:02BW:title",
          "verified_before_output_at": "2026-10-15T03:55:31.726536+00:00"
        },
        {
          "actual_thread": "01a1286b-8ccb-7590-b366-ddf029a39aea",
          "complete_freeze_hash": "sha256:da1544ce54c5a7ef426d4f3ab0e971490b73e73b18f91fb09885a14f2518e81e",
          "effort": "xhigh",
          "frozen_context_hash": "sha256:a1d80a3437b91b21a4ecfd16cb0f78af2b24ee1adae11f270cb2894eb563829a",
          "literal_call_timestamp": "2026-10-15T03:57:14.892Z",
          "literal_file_hash": "sha256:7f171e83b904ac5b39011f9771849e0df00498b9a572d2dcb888e12968a94613",
          "model": "gpt-6.1-sol",
          "scope_manifest_hash": "sha256:8f23e238f12db9f46f89b1de4eb49a96fffd7da771fff51bfebfc72477cec8ac",
          "turn_id": "01a13db2-ca1f-74f1-ae2c-351eb78d0a42",
          "unit_id": "tag:02BW:paragraph-0001",
          "verified_before_output_at": "2026-10-15T03:55:31.726536+00:00"
        }
      ],
      "assembly_harness_version": "0.163.0-alpha.10.2",
      "reasoning_effort": "xhigh",
      "source_catalog_revisions": [
        "sha256:8fc1b2bb210402368ee6f222e65fc4bec618aa578ca8b97bb0357a20d5232311"
      ]
    }
  },
  "model": {
    "identity_confidence": "declared",
    "provider": "OpenAI",
    "record_id": "openai:gpt-6.1-sol:declared",
    "requested_id": "gpt-6.1-sol",
    "resolved_id": "gpt-6.1-sol",
    "snapshot": null
  },
  "notes": [
    "Complete actual five-field model records copied verbatim; programs only protect, serialize, verify and assemble.",
    "Per-unit actual turn, effort, frozen context and literal hashes are recorded; retries retain their original runtime and context identities.",
    "All prior complete groups, candidates, runs and recursive derivation history are preserved.",
    "Candidate only: unknown terms remain pending; no glossary, critic, human language/mathematics or publication approval."
  ],
  "replayable": false,
  "run_id": "run-20261015-bulk-desirables-02bw-gpt61sol",
  "run_kind": "revision",
  "schema_version": 1,
  "source_commit": "a04446e57ec1fbc252a871afcec7752fb2807b14",
  "status": "recorded",
  "task_id": "integrated-remediation-f1-f8-20261014",
  "unit_ids": [
    "tag:02BW:title",
    "tag:02BW:paragraph-0001"
  ]
}
