{
  "schema_version": 1,
  "run_id": "run-review-categories-0fww-20261005",
  "run_kind": "revision",
  "task_id": "review-categories-0fww-20261005",
  "source_commit": "a04446e57ec1fbc252a871afcec7752fb2807b14",
  "unit_ids": [
    "tag:0FWW:title",
    "tag:0FWW:p001",
    "tag:0FWX:statement",
    "tag:0FWY:statement",
    "tag:0FWY:proof-p001"
  ],
  "harness": {
    "id": "codex",
    "version": "0.160.0",
    "adapter_version": "stacks-harness-v1"
  },
  "model": {
    "record_id": "openai:gpt-6.1-sol:declared",
    "provider": "OpenAI",
    "requested_id": "gpt-6.1-sol",
    "resolved_id": "gpt-6.1-sol",
    "snapshot": null,
    "identity_confidence": "declared"
  },
  "inputs": {
    "prompt_version": "translator-v2",
    "policy_revision": "git:d1eb78195d905ca45a532ed321ec4130f1d45328",
    "glossary_revision": "git:981e3ab307d1aa36f4ba8e0a6ccd78b6f5a641ba",
    "context_hashes": [
      "sha256:64b9c8acb53f11d698859c0f47bb144d78846ad8b350609d684199763eed1971",
      "sha256:d8a1366b619470a954f8a30c65711ca82337dc4375ad6b961d59d89fbdfd73d5",
      "sha256:8739a3b33a0f9a5eae0106273087c3d9509086b6b30c1543724d35f6f67a1897",
      "sha256:3a32b7d802f33b22e715450e6f1a4772bedbbde505097910915514035745d439",
      "sha256:09557738a17d51e250f81e4aa3fac782568731f4c09d571cfaf8be145a5d54e5"
    ]
  },
  "created_at": "2026-10-05T02:14:37.705867+00:00",
  "replayable": false,
  "status": "recorded",
  "notes": [
    "Actual complete GPT-6.1-sol revision in the current Codex task; declared runtime model, provider snapshot unavailable.",
    "Original units/candidates and complete corrected source/context are frozen. No historical run was rewritten; terminology remains pending and no human or independent critic review is claimed."
  ]
}
