{
  "schema_version": 1,
  "run_id": "run-20260826-categories-0032-gpt56sol-01",
  "run_kind": "translation",
  "task_id": "categories-0032",
  "source_commit": "a04446e57ec1fbc252a871afcec7752fb2807b14",
  "unit_ids": [
    "tag:0032:statement",
    "tag:0032:item001",
    "tag:0032:item001-display001",
    "tag:0032:item001-p001",
    "tag:0032:item002",
    "tag:0032:item002-display001",
    "tag:0032:item002-p001",
    "tag:0032:proof-p001",
    "tag:0032:proof-p002",
    "tag:0032:proof-p003",
    "tag:0032:proof-p004",
    "tag:0032:proof-p005",
    "tag:0032:proof-p006",
    "tag:0032:proof-display001",
    "tag:0032:proof-p007"
  ],
  "harness": {
    "id": "codex",
    "version": "unknown",
    "adapter_version": "stacks-harness-v1"
  },
  "model": {
    "record_id": "openai:gpt-5.6-sol:owner-confirmed",
    "provider": "OpenAI",
    "requested_id": "gpt-5.6-sol",
    "resolved_id": "gpt-5.6-sol",
    "snapshot": null,
    "identity_confidence": "owner-confirmed"
  },
  "inputs": {
    "prompt_version": "translator-v2",
    "policy_revision": "git:ef948f1bb1c32247259389c5dc2b360d1743d4ae",
    "glossary_revision": "git:981e3ab307d1aa36f4ba8e0a6ccd78b6f5a641ba",
    "context_hashes": [
      "sha256:a7b1f95a154000ed6dfa2af4714fc111dd1128d0079b6e4ac82f3c1cc8c5a1b4",
      "sha256:c64e77c550943c2af9e68b5faa38454d0f371c3de35d191e65e52b5a4af413e0",
      "sha256:63ffad7b12b9d537267c63acd3eaaa31a2c15535da329bf81ebcc2cf3038cfbd",
      "sha256:de887d148dd0a509457097b91fdc31e983b7bd5cf6d78a0e056fc8994e36c02e",
      "sha256:c2fc77d0a6969259c081d44e16dea0fce025f1d0f8cdee0bb3198fc3ba85ef5f",
      "sha256:c966bcc4dc196cb26136a0cf4fc7ec1496fabfe31b8c6531a03edfc4b32eb904",
      "sha256:9ecb469fe239c85f0b9cad08c98d1509f9f79d3e39425cd9650e5f29d0bab58c",
      "sha256:54dfc32e75dd48982acd6777e72d823411fa1ccb2324b6534c3f07196ef5d8a1",
      "sha256:1933ec15294ea785c8fda0a4356ac94bd640721f5b138884621b513c83508ce1",
      "sha256:9589c368cad69db6fdf14d5ce66f627e7a08efe3e562899f4ef902cbb2d2ab8a",
      "sha256:4c8bc4e2b332e9d451f27c7bbb44bfeda352fa62c5be3999474bdcbe494b69b8",
      "sha256:a625c3f9d34c8ee1580fd2457e194f92bcf1b01936295d1fbe05c2d8f041c066",
      "sha256:f556acccd6af5828c058bd7a7bec97a28505c425fb317e95a4935bb78700001d",
      "sha256:8c72efca91d1bad1eb9e3cc87103750dd42e6ddfc3335ba2d500891928dba034",
      "sha256:1caaf77c909c7f3a6fde7f3c8c82de01a06095e2d13830abb37bd9a3b8538662"
    ]
  },
  "created_at": "2026-08-26T08:00:00+08:00",
  "replayable": false,
  "status": "recorded",
  "notes": [
    "The Codex runtime did not expose a provider snapshot."
  ]
}
