{
  "created_at": "2026-10-16T05:09:08.940424Z",
  "harness": {
    "adapter_version": "stacks-harness-v1",
    "id": "codex",
    "version": "0.162.0-alpha.17.2"
  },
  "inputs": {
    "context_hashes": [
      "sha256:9ca885eed21ffd916be8cc1d4ee1d118a60afa41a4295ba08ea0b14df37c1b31"
    ],
    "glossary_revision": "git:5b527d9cf753ba3f589d1cc7fe9d18be31ddfd81",
    "policy_revision": "git:5b527d9cf753ba3f589d1cc7fe9d18be31ddfd81",
    "prompt_version": "translator-v2",
    "settings": {
      "actual_runtime_by_unit": [
        {
          "actual_thread": "01a1286b-8ccb-7590-b366-ddf029a39aea",
          "complete_freeze_hash": "sha256:db6af97e1eadf76f02745a5ec005ae0ede88efb962ab82ec954ef08ca2a5e897",
          "effort": "xhigh",
          "frozen_context_hash": "sha256:9ca885eed21ffd916be8cc1d4ee1d118a60afa41a4295ba08ea0b14df37c1b31",
          "literal_call_timestamp": "2026-10-16T00:30:31.549Z",
          "literal_file_hash": "sha256:c59e7bdbce6f3869c5cc0eecaa3287bfcaa9870f2452aa87e3904098283b3b1a",
          "model": "gpt-6.1-sol",
          "scope_manifest_hash": "sha256:77fabf3a694ac0d4925c59f780d179e049cc729ba6dc6d3c9b1eba417ec9fa7a",
          "turn_id": "01a14205-c39d-7f12-a5b7-feec6dfe8682",
          "unit_id": "tag:0G2W:statement",
          "verified_before_output_at": "2026-10-16T00:29:51.802752+00:00"
        }
      ],
      "assembly_harness_version": "0.163.0-alpha.10.2",
      "reasoning_effort": "xhigh",
      "source_catalog_revisions": [
        "sha256:d5a8e729960fec8dfee0473991cf09f094c74977a9c3729aaed568798b102671"
      ]
    }
  },
  "model": {
    "identity_confidence": "declared",
    "provider": "OpenAI",
    "record_id": "openai:gpt-6.1-sol:declared",
    "requested_id": "gpt-6.1-sol",
    "resolved_id": "gpt-6.1-sol",
    "snapshot": null
  },
  "notes": [
    "Complete actual five-field model records copied verbatim; programs only protect, serialize, verify and assemble.",
    "Per-unit actual turn, effort, frozen context and literal hashes are recorded; retries retain their original runtime and context identities.",
    "All prior complete groups, candidates, runs and recursive derivation history are preserved.",
    "Candidate only: unknown terms remain pending; no glossary, critic, human language/mathematics or publication approval."
  ],
  "replayable": false,
  "run_id": "run-20261016-bulk-extra-categories-0g2w-gpt61sol",
  "run_kind": "revision",
  "schema_version": 1,
  "source_commit": "a04446e57ec1fbc252a871afcec7752fb2807b14",
  "status": "recorded",
  "task_id": "integrated-remediation-f1-f8-20261014",
  "unit_ids": [
    "tag:0G2W:statement"
  ]
}
