{
  "schema_version": 1,
  "run_id": "legacy-categories-001T-gpt56sol",
  "run_kind": "historical-import",
  "task_id": "legacy-categories-001T",
  "source_commit": "a04446e57ec1fbc252a871afcec7752fb2807b14",
  "unit_ids": [
    "tag:001T:statement",
    "tag:001T:p001"
  ],
  "harness": {
    "id": "codex",
    "version": "unknown",
    "adapter_version": "stacks-harness-v1"
  },
  "model": {
    "record_id": "openai:gpt-5.6-sol:owner-confirmed",
    "provider": "OpenAI",
    "requested_id": "gpt-5.6-sol",
    "resolved_id": "gpt-5.6-sol",
    "snapshot": null,
    "identity_confidence": "owner-confirmed"
  },
  "inputs": {
    "prompt_version": "translator-v2",
    "policy_revision": "git:cbe7df1c66e7a6f3acd07eb029b97c91fcbbee95",
    "glossary_revision": "git:a82c7e73355a7087e43a1f61c85bdf2a967a25cd",
    "context_hashes": [
      "sha256:84e8d0e8c5e7c24c3b6c0bae110f07aad817cec429410af1a02155b36a4c82d1",
      "sha256:416e519dce371a7b9dc97d0054652f6061cc862e679c7cfc9d0cb0176fa56136"
    ]
  },
  "created_at": "2026-08-25T23:45:00+08:00",
  "replayable": false,
  "status": "recorded",
  "notes": [
    "Historical candidate import; model identity confirmed by project owner.",
    "The original Codex runtime did not expose a provider snapshot."
  ]
}
