{
  "schema_version": 1,
  "run_id": "legacy-categories-002J-gpt56sol",
  "run_kind": "historical-import",
  "task_id": "legacy-categories-002J",
  "source_commit": "a04446e57ec1fbc252a871afcec7752fb2807b14",
  "unit_ids": [
    "tag:002J:statement",
    "tag:002J:p001"
  ],
  "harness": {
    "id": "codex",
    "version": "unknown",
    "adapter_version": "stacks-harness-v1"
  },
  "model": {
    "record_id": "openai:gpt-5.6-sol:owner-confirmed",
    "provider": "OpenAI",
    "requested_id": "gpt-5.6-sol",
    "resolved_id": "gpt-5.6-sol",
    "snapshot": null,
    "identity_confidence": "owner-confirmed"
  },
  "inputs": {
    "prompt_version": "translator-v2",
    "policy_revision": "git:cbe7df1c66e7a6f3acd07eb029b97c91fcbbee95",
    "glossary_revision": "git:a82c7e73355a7087e43a1f61c85bdf2a967a25cd",
    "context_hashes": [
      "sha256:e1d7d1f3c10042806a2a2b26d4be6d6fab2d918db9edffef4280e43f4faeaec8",
      "sha256:9977a33960820e5cb5582a4274e29ac7bdc3f481853d0e594f4375899b2996b9"
    ]
  },
  "created_at": "2026-08-25T10:50:00+08:00",
  "replayable": false,
  "status": "recorded",
  "notes": [
    "Historical candidate import; model identity confirmed by project owner.",
    "The original Codex runtime did not expose a provider snapshot."
  ]
}
