{
  "schema_version": 1,
  "run_id": "run-20260829-guide-03B6-remaining-gpt56sol-01",
  "run_kind": "translation",
  "task_id": "guide-03B6-remaining-gpt56sol",
  "source_commit": "a04446e57ec1fbc252a871afcec7752fb2807b14",
  "unit_ids": [
    "tag:04V1:title",
    "tag:04V1:p001",
    "tag:04V1:item001",
    "tag:04V1:item001-quote",
    "tag:04V1:item002",
    "tag:04V1:item002-quote",
    "tag:04V1:item003",
    "tag:04V1:item003-quote",
    "tag:04V1:item004",
    "tag:04V1:item004-quote",
    "tag:04V1:item005",
    "tag:04V1:item005-quote",
    "tag:04V1:item006",
    "tag:04V1:item006-quote",
    "tag:04V2:title",
    "tag:04V2:p001",
    "tag:04V2:item001",
    "tag:04V2:item001-quote",
    "tag:04V2:item002",
    "tag:04V2:item002-quote",
    "tag:04V2:item003",
    "tag:04V2:item003-quote",
    "tag:04V2:item004",
    "tag:04V2:item004-quote",
    "tag:04V3:title",
    "tag:04V3:p001",
    "tag:04V3:item001",
    "tag:04V3:item001-quote",
    "tag:04V3:item002",
    "tag:04V3:item002-quote",
    "tag:04V4:title",
    "tag:04V4:p001",
    "tag:04V4:item001",
    "tag:04V4:item001-quote",
    "tag:04V4:item002",
    "tag:04V4:item002-quote",
    "tag:04V4:item003",
    "tag:04V4:item003-quote",
    "tag:04V4:item004",
    "tag:04V4:item004-quote",
    "tag:04V4:item005",
    "tag:04V4:item005-quote",
    "tag:04V4:item006",
    "tag:04V4:item006-quote",
    "tag:04V4:item007",
    "tag:04V4:item007-quote",
    "tag:04V4:item008",
    "tag:04V4:item008-quote"
  ],
  "harness": {
    "id": "codex",
    "version": "unknown",
    "adapter_version": "stacks-harness-v1"
  },
  "model": {
    "record_id": "openai:gpt-5.6-sol:owner-confirmed",
    "provider": "OpenAI",
    "requested_id": "gpt-5.6-sol",
    "resolved_id": "gpt-5.6-sol",
    "snapshot": null,
    "identity_confidence": "owner-confirmed"
  },
  "inputs": {
    "prompt_version": "translator-v2",
    "policy_revision": "git:353ccf06ffc8ca2748105e22aabf422cc395a7ef",
    "glossary_revision": "git:981e3ab307d1aa36f4ba8e0a6ccd78b6f5a641ba",
    "context_hashes": [
      "sha256:def41e56e9bde8d80864d1bfbb296835ce3cf75e1bb923aefbcf748254823b05",
      "sha256:27c12ed2e6a38fd41ed00720e2c20ec191a52cbec6cb6d7723bf3225c18d4fec",
      "sha256:12b14ed4ec0c934645aeafb7f0bc84aff7c05fb3b9d193bf51a93e68ccbecaa4",
      "sha256:4ac7c67ef454089be855e1411bab6ef51078f8e430a7d5edd91c339e5502e295",
      "sha256:bf20a033a00e53ced6da0b37e81300b2493c592921f62595bb1f405736b74773",
      "sha256:99778bb705847469bce16dc08e129d4b9d91f6ab103f48cf7c97b844debee0b7",
      "sha256:9e1d8b58fe3ceeb088fd3ebd6d7f808f3a21ef220714a8fa859e6547fb9e0618",
      "sha256:3bed0a2fd08101b7f25975b62c1174de49ccc57fddcef4a579b125a953dea8f7",
      "sha256:3520654fe5f18225e07cba4a337d6eab1f657cfa6d68f451deec272b379ac015",
      "sha256:1271f53144ce90f85833239cd2ae8c1f62205818ce9ad6bb246cb7d459166a3f",
      "sha256:34b9f488b3a76700267053671f95b0e0f64d5950f2c6d4566a48001ae7e3bb40",
      "sha256:e4685f2ed12a9837a52cd9bd8d19319e2dbde73dc64f2491746f0937ab41edd3",
      "sha256:5d75730a65778bb211cd501892bf8eb659b8be7bdc1e1f3ecbeca088430759cf",
      "sha256:ad23f505c4cab783c7514e967f6bf15fab2232af22933da5c0e19bfcb06b2269",
      "sha256:f918ee9b192dd32215c9bd5eeb46166a5c497942c438d9263f501d3fbcdef6b1",
      "sha256:6d3c798f27303b28cb00bb282d9fbed49b8e9d0d694341555e8ee57d53415763",
      "sha256:fe2a111f7914aa90b212822edbaaa956c090af10b2184c0e7b1f73eeeaa4514d",
      "sha256:a980acdd7141cb5e94b9bfc4553212c633ec392cf076efc4760a0fc22dc777e7",
      "sha256:8a18d0961f5a5c5c96f520dba8d3ddec5270f456cd3bad69cbd15b167b9aebf1",
      "sha256:3d71912b597f868094068feee051cafc00457b951e24fc8d2daf0830619fb3ca",
      "sha256:25fc4eb4b7531f994ff7c98825c07fbca1e017c8e3af639b38b10232c1f7e6d0",
      "sha256:7243aa19b35b17b29b15221d53277cf5cfdbe81faa7bc65d5852260a06bd4dd0",
      "sha256:7702d924712290fda028ef6c0f6517560c58d7be564aadef27a9eb1e27b6ce4d",
      "sha256:785b5a94625c3fb05246794778669437052b35d20fb4bdd5e3234fad8542ae2a",
      "sha256:6eae55f124825cb7e88a08179176d3126db3608c8d7e551b6b7a7cde85c9e527",
      "sha256:9d841b820d3418a2dcabce98cd768dfe848dac61ffc5206df280e1b175ad62e5",
      "sha256:d2687b611854c8a72afa7bc81c8f44212210ec7964b5eb30f4aa7d42d89259c2",
      "sha256:ed498967962de364bd5f3235e515aaffb68d8a227c0f9b96e587fc6772483318",
      "sha256:81dc3ff24d9ef6e744af742684c9c9e9d772181087f5e001fc70c5189ee6009d",
      "sha256:1df7acaeaa33289b6ab5ee43c234a9f4bbb4bae93fe1b20b47ef3593a806d762",
      "sha256:c4f317ae0d4dfecfe60dda2120e200db8db3eea77282be97982f758b7a9ff31a",
      "sha256:0ffba5e6bd4438e3721e25b07e704a799be38e8443c2c99ff051d28e21e37bc9",
      "sha256:377950f253c3497f9704efcc34afc64d93ba72727aef30a6e69e1e75d2fc2b84",
      "sha256:d1082b07dcb66cf3b4672a655c0f2b6c3e13f5e019a9d37dbbe749f2ecc3eea2",
      "sha256:2b9f81e1532298ce57bc9da8c329ab08e01a06b0ecc04111f548633ee19df5ae",
      "sha256:79ec0bddd6c88d554f345247aedf6c9127736b8eeeb85d767608b6be7cf6ac5f",
      "sha256:5b6cdcb4dea9aaa8aa342fcf53f512fa17b738f3acd0e056e3d81487b7c61f7a",
      "sha256:444039bd8f82073eb4e88b67d357c324abbdc9b12dc844ea166160c7eab6a947",
      "sha256:b204be86e609a51e7780310050a18bb68fac42001dc3ded502b70e97f9dffa76",
      "sha256:c6132a0e6c6b81c02755c5835069eae06245928c47295d3ea7e3b2fd51552239",
      "sha256:a8b2a66a9a321176baa8372aae19df09c024be8b7677372b3122c38a839bb22c",
      "sha256:ace120a56843aee7e3f615e4751157404cdde7166c6839fb79a2069269340fd7",
      "sha256:dedd16a7864cdbe8000d0eeeb05051ad9c37961ceacc590e032f91204a7d27b3",
      "sha256:283ec87ce7ad463c729481bab33425ef63493899b758a3069b2edcb564731871",
      "sha256:a901049c193f5b0cb1224ed77df6a4457564e5db19e843801607992fce260689",
      "sha256:a4f4b1123c9139f22c3a558dcfcdd6fec87383373e81dd6db9273275dad09225",
      "sha256:235b9c6355ebbb253a2a52d1338ce79a841d9652ca4e5ef094f5ced788ce6064",
      "sha256:2beacf912f4aaf99f49d2b33c70bce844b72ec771a585819037684d70623cb4c"
    ]
  },
  "created_at": "2026-08-29T13:40:00+08:00",
  "replayable": false,
  "status": "recorded",
  "notes": []
}
