{
  "created_at": "2026-10-16T05:09:08.940424Z",
  "harness": {
    "adapter_version": "stacks-harness-v1",
    "id": "codex",
    "version": "0.162.0-alpha.17.2"
  },
  "inputs": {
    "context_hashes": [
      "sha256:11aaf296355a0157bf5e149d6405fff1f7aee708e566a46d896fe462cb4c90f9",
      "sha256:5c880025e6846e8615ca18d45a55bfe84599d979c963ad1f05c62e129ae44080"
    ],
    "glossary_revision": "git:5b527d9cf753ba3f589d1cc7fe9d18be31ddfd81",
    "policy_revision": "git:5b527d9cf753ba3f589d1cc7fe9d18be31ddfd81",
    "prompt_version": "translator-v2",
    "settings": {
      "actual_runtime_by_unit": [
        {
          "actual_thread": "01a1286b-8ccb-7590-b366-ddf029a39aea",
          "complete_freeze_hash": "sha256:da1544ce54c5a7ef426d4f3ab0e971490b73e73b18f91fb09885a14f2518e81e",
          "effort": "xhigh",
          "frozen_context_hash": "sha256:11aaf296355a0157bf5e149d6405fff1f7aee708e566a46d896fe462cb4c90f9",
          "literal_call_timestamp": "2026-10-15T00:41:01.516Z",
          "literal_file_hash": "sha256:b50da5f0722dbd60b46454de599616d7d0dd30acbb4cb86a1b92a21baf642f5e",
          "model": "gpt-6.1-sol",
          "scope_manifest_hash": "sha256:8f23e238f12db9f46f89b1de4eb49a96fffd7da771fff51bfebfc72477cec8ac",
          "turn_id": "01a13cc2-701a-7113-9b3b-dcf380e28638",
          "unit_id": "tag:02BK:title",
          "verified_before_output_at": "2026-10-15T00:38:01.454664+00:00"
        },
        {
          "actual_thread": "01a1286b-8ccb-7590-b366-ddf029a39aea",
          "complete_freeze_hash": "sha256:5c404e095a5cca8aa93f62c0fa203449a252f83aef5f4f07402121874029a992",
          "effort": "xhigh",
          "frozen_context_hash": "sha256:5c880025e6846e8615ca18d45a55bfe84599d979c963ad1f05c62e129ae44080",
          "literal_call_timestamp": "2026-10-15T17:30:34.259Z",
          "literal_file_hash": "sha256:afc407ed1d15595570c889aed457b61c31f2698c141276fef72ebd57b96351ea",
          "model": "gpt-6.1-sol",
          "scope_manifest_hash": "sha256:8b4496291a99a73b7339fd63a2b45045749f0da78dd7985354f23aa3117ee4f2",
          "turn_id": "01a14070-ca99-7420-bc8a-686856048ded",
          "unit_id": "tag:02BK:prose-0001",
          "verified_before_output_at": "2026-10-15T17:29:11.073827+00:00"
        }
      ],
      "assembly_harness_version": "0.163.0-alpha.10.2",
      "reasoning_effort": "xhigh",
      "source_catalog_revisions": [
        "sha256:82aca260354c680396c7e96aff78c7bebf63e12b27a46bf5b73652d13eccd44a",
        "sha256:8fc1b2bb210402368ee6f222e65fc4bec618aa578ca8b97bb0357a20d5232311"
      ]
    }
  },
  "model": {
    "identity_confidence": "declared",
    "provider": "OpenAI",
    "record_id": "openai:gpt-6.1-sol:declared",
    "requested_id": "gpt-6.1-sol",
    "resolved_id": "gpt-6.1-sol",
    "snapshot": null
  },
  "notes": [
    "Complete actual five-field model records copied verbatim; programs only protect, serialize, verify and assemble.",
    "Per-unit actual turn, effort, frozen context and literal hashes are recorded; retries retain their original runtime and context identities.",
    "All prior complete groups, candidates, runs and recursive derivation history are preserved.",
    "Candidate only: unknown terms remain pending; no glossary, critic, human language/mathematics or publication approval."
  ],
  "replayable": false,
  "run_id": "run-20261015-bulk-desirables-02bk-gpt61sol",
  "run_kind": "revision",
  "schema_version": 1,
  "source_commit": "a04446e57ec1fbc252a871afcec7752fb2807b14",
  "status": "recorded",
  "task_id": "integrated-remediation-f1-f8-20261014",
  "unit_ids": [
    "tag:02BK:title",
    "tag:02BK:prose-0001"
  ]
}
