{
  "schema_version": 1,
  "run_id": "legacy-categories-001N-gpt56sol",
  "run_kind": "historical-import",
  "task_id": "legacy-categories-001N",
  "source_commit": "a04446e57ec1fbc252a871afcec7752fb2807b14",
  "unit_ids": [
    "tag:001N:statement",
    "tag:001N:p001"
  ],
  "harness": {
    "id": "codex",
    "version": "unknown",
    "adapter_version": "stacks-harness-v1"
  },
  "model": {
    "record_id": "openai:gpt-5.6-sol:owner-confirmed",
    "provider": "OpenAI",
    "requested_id": "gpt-5.6-sol",
    "resolved_id": "gpt-5.6-sol",
    "snapshot": null,
    "identity_confidence": "owner-confirmed"
  },
  "inputs": {
    "prompt_version": "translator-v2",
    "policy_revision": "git:cbe7df1c66e7a6f3acd07eb029b97c91fcbbee95",
    "glossary_revision": "git:a82c7e73355a7087e43a1f61c85bdf2a967a25cd",
    "context_hashes": [
      "sha256:2a9b934b4fa5059b4a7a472514d9bca74bc66167a012359dd38005502970abeb",
      "sha256:af054450c45bfe82e47477b48a385af41a275b74a4ce99f23638b7927121302d"
    ]
  },
  "created_at": "2026-08-25T22:15:00+08:00",
  "replayable": false,
  "status": "recorded",
  "notes": [
    "Historical candidate import; model identity confirmed by project owner.",
    "The original Codex runtime did not expose a provider snapshot."
  ]
}
